### ISSUE TITLE
[Janus version: 1301 (1.3.1)] WEBSOCKET CLOSES IMMEDIATELY

### ISSUE THREAD

**Issue by keithwilliamsjr** [meetecho/janus-gateway#3524]
**What version of Janus is this happening on?**
Janus version: 1301 (1.3.1)
Janus commit: 1747c8f5aedd30e463ed35047f7b80e74ee3f96b

**Have you tested a more recent version of Janus too?**
No. This most recent?

**Was this working before?**
No, never worked.

**Is there a gdb or libasan trace of the issue?**
No

**Additional context**
Websocket opens and then closes immediately upon receiving a request. Everything is initializing properly, 8188 is listening but when trying to wscat it closes socket immediately. I don' tknow what to do. I have recompiled/rebuilt janus 5 times. Still no luck. I'm running on ubuntu server 24 in a truenas vm. Here's my logs from:

sudo tcpdump -i any port 8188 -vv
keith@hpb:~/rabbitmq-c/build/janus-gateway$ sudo tcpdump -i any port 8188 -vv
tcpdump: data link type LINUX_SLL2
tcpdump: listening on any, link-type LINUX_SLL2 (Linux cooked v2), snapshot length 262144 bytes
00:01:18.245981 lo    In  IP (tos 0x0, ttl 64, id 60675, offset 0, flags [DF], proto TCP (6), length 60)
    hpb.37830 > hpb.8188: Flags [S], cksum 0x844b (incorrect -> 0x3b37), seq 3324123467, win 65495, options [mss 65495,sackOK,TS val 1103477178 ecr 0,nop,wscale 7], length 0
00:01:18.246011 lo    In  IP (tos 0x0, ttl 64, id 0, offset 0, flags [DF], proto TCP (6), length 60)
    hpb.8188 > hpb.37830: Flags [S.], cksum 0x844b (incorrect -> 0xbe4e), seq 1893994622, ack 3324123468, win 65483, options [mss 65495,sackOK,TS val 1103477179 ecr 1103477178,nop,wscale 7], length 0
00:01:18.246032 lo    In  IP (tos 0x0, ttl 64, id 60676, offset 0, flags [DF], proto TCP (6), length 52)
    hpb.37830 > hpb.8188: Flags [.], cksum 0x8443 (incorrect -> 0xe509), seq 1, ack 1, win 512, options [nop,nop,TS val 1103477179 ecr 1103477179], length 0
00:01:18.249537 lo    In  IP (tos 0x0, ttl 64, id 60677, offset 0, flags [DF], proto TCP (6), length 279)
    hpb.37830 > hpb.8188: Flags [P.], cksum 0x8526 (incorrect -> 0x8c7f), seq 1:228, ack 1, win 512, options [nop,nop,TS val 1103477182 ecr 1103477179], length 227
00:01:18.249554 lo    In  IP (tos 0x0, ttl 64, id 30014, offset 0, flags [DF], proto TCP (6), length 52)
    hpb.8188 > hpb.37830: Flags [.], cksum 0x8443 (incorrect -> 0xe422), seq 1, ack 228, win 510, options [nop,nop,TS val 1103477182 ecr 1103477182], length 0
00:01:18.249752 lo    In  IP (tos 0x0, ttl 64, id 30015, offset 0, flags [DF], proto TCP (6), length 52)
    hpb.8188 > hpb.37830: Flags [F.], cksum 0x8443 (incorrect -> 0xe41f), seq 1, ack 228, win 512, options [nop,nop,TS val 1103477182 ecr 1103477182], length 0
00:01:18.250043 lo    In  IP (tos 0x0, ttl 64, id 60678, offset 0, flags [DF], proto TCP (6), length 52)
    hpb.37830 > hpb.8188: Flags [.], cksum 0x8443 (incorrect -> 0xe41e), seq 228, ack 2, win 512, options [nop,nop,TS val 1103477183 ecr 1103477182], length 0
00:01:18.260556 lo    In  IP (tos 0x0, ttl 64, id 60679, offset 0, flags [DF], proto TCP (6), length 52)
    hpb.37830 > hpb.8188: Flags [F.], cksum 0x8443 (incorrect -> 0xe413), seq 228, ack 2, win 512, options [nop,nop,TS val 1103477193 ecr 1103477182], length 0
00:01:18.260573 lo    In  IP (tos 0x0, ttl 64, id 0, offset 0, flags [DF], proto TCP (6), length 52)
    hpb.8188 > hpb.37830: Flags [.], cksum 0xe408 (correct), seq 2, ack 229, win 512, options [nop,nop,TS val 1103477193 ecr 1103477193], length 0

and logs from journalctl

keith@hpb:~/rabbitmq-c/build/janus-gateway$ sudo journalctl -u janus --no-pager --lines=50 | grep websocket
[sudo] password for keith: 
Mar 03 00:22:50 hpb janus[49196]: [libwebsockets][DEBUG] [2025/03/03 00:22:50:7644] D: _lws_state_transition: system: changed 11 'AUTH2' -> 12 'ONE_TIME_UPDATES'
Mar 03 00:22:50 hpb janus[49196]: [libwebsockets][DEBUG] [2025/03/03 00:22:50:7644] D: _lws_state_transition: system: changed 12 'ONE_TIME_UPDATES' -> 13 'OPERATIONAL'
Mar 03 00:22:50 hpb janus[49196]: [libwebsockets][INFO] [2025/03/03 00:22:50:7644] I: lws_state_transition_steps: INITIALIZED -> OPERATIONAL
Mar 03 00:25:27 hpb janus[49196]: [libwebsockets][DEBUG] [2025/03/03 00:25:27:8472] D: accepted new conn port 49370 on fd=24
Mar 03 00:25:27 hpb janus[49196]: [libwebsockets][DEBUG] [2025/03/03 00:25:27:8472] D: lws_get_idlest_tsi: 3 1023
Mar 03 00:25:27 hpb janus[49196]: [libwebsockets][DEBUG] [2025/03/03 00:25:27:8473] D: _realloc: size 1352: __lws_wsi_create_with_role
Mar 03 00:25:27 hpb janus[49196]: [libwebsockets][DEBUG] [2025/03/03 00:25:27:8473] D: : lws_role_transition: wsistate 0x200, ops (unset)
Mar 03 00:25:27 hpb janus[49196]: [libwebsockets][DEBUG] [2025/03/03 00:25:27:8473] D: [wsisrv|0|default|(null)]: lws_create_new_server_wsi: joining vh default, tsi 0
Mar 03 00:25:27 hpb janus[49196]: [libwebsockets][DEBUG] [2025/03/03 00:25:27:8473] D: [wsisrv|0|default|(null)]: lws_vhost_bind_wsi: vh default: wsi none/none, count_bound_wsi 2
Mar 03 00:25:27 hpb janus[49196]: [libwebsockets][DEBUG] [2025/03/03 00:25:27:8473] D: [wsisrv|0|default|(null)]: lwsi_set_state: lwsi_set_state 0x20000200 -> 0x20000200
Mar 03 00:25:27 hpb janus[49196]: [libwebsockets][DEBUG] [2025/03/03 00:25:27:8473] D: [wsisrv|0|default|(null)]: lws_role_transition: wsistate 0x20000016, ops h1
Mar 03 00:25:27 hpb janus[49196]: [libwebsockets][DEBUG] [2025/03/03 00:25:27:8473] D: [wsisrv|0|default|(null)]: __lws_set_timeout: 15 secs, reason 3
Mar 03 00:25:27 hpb janus[49196]: [libwebsockets][DEBUG] [2025/03/03 00:25:27:8473] D: [wsisrv|0|default|(null)]: __insert_wsi_socket_into_fds: tsi=0, sock=24, pos-in-fds=3
Mar 03 00:25:27 hpb janus[49196]: [libwebsockets][INFO] [2025/03/03 00:25:27:8473] I: lws_header_table_attach: [wsisrv|0|default|(null)]: ah (nil) (tsi 0, count = 0) in
Mar 03 00:25:27 hpb janus[49196]: [libwebsockets][DEBUG] [2025/03/03 00:25:27:8473] D: _realloc: size 992: ah struct
Mar 03 00:25:27 hpb janus[49196]: [libwebsockets][DEBUG] [2025/03/03 00:25:27:8473] D: _realloc: size 4096: ah data
Mar 03 00:25:27 hpb janus[49196]: [libwebsockets][INFO] [2025/03/03 00:25:27:8473] I: _lws_create_ah: created ah 0x7a21f0006d20 (size 4096): pool length 1
Mar 03 00:25:27 hpb janus[49196]: [libwebsockets][DEBUG] [2025/03/03 00:25:27:8473] D: [wsisrv|0|default|(null)]: _lws_change_pollfd: fd 24 events 1 -> 1
Mar 03 00:25:27 hpb janus[49196]: [libwebsockets][INFO] [2025/03/03 00:25:27:8474] I: lws_header_table_attach: did attach wsi [wsisrv|0|default|(null)]: ah 0x7a21f0006d20: count 1 (on exit)
Mar 03 00:25:27 hpb janus[49196]: [libwebsockets][DEBUG] [2025/03/03 00:25:27:8474] D: [wsisrv|0|default|(null)]: __lws_set_timeout: 10 secs, reason 25
Mar 03 00:25:27 hpb janus[49196]: [libwebsockets][DEBUG] [2025/03/03 00:25:27:8474] D: Attached ah immediately
Mar 03 00:25:27 hpb janus[49196]: [libwebsockets][INFO] [2025/03/03 00:25:27:8474] I: [wsisrv|0|default|(null)]: lws_adopt_descriptor_vhost2: vhost [vh|2|default||8188]
Mar 03 00:25:27 hpb janus[49196]: [libwebsockets][DEBUG] [2025/03/03 00:25:27:8501] D: rops_handle_POLLIN_h1: [wsisrv|0|default|(null)]: wsistate 0x20000016
Mar 03 00:25:27 hpb janus[49196]: [libwebsockets][DEBUG] [2025/03/03 00:25:27:8501] D: [wsisrv|0|default|(null)]: lws_buflist_aware_read: lws_h1_server_socket_service: ssl_capable_read 232
Mar 03 00:25:27 hpb janus[49196]: [libwebsockets][DEBUG] [2025/03/03 00:25:27:8501] D: lws_read_h1: h1 path: wsi state 0x16
Mar 03 00:25:27 hpb janus[49196]: [libwebsockets][INFO] [2025/03/03 00:25:27:8502] I: lws_handshake_server: parsed count 232
Mar 03 00:25:27 hpb janus[49196]: [libwebsockets][INFO] [2025/03/03 00:25:27:8502] I: lws_select_vhost: vhost match to default based on port 8188
Mar 03 00:25:27 hpb janus[49196]: [libwebsockets][DEBUG] [2025/03/03 00:25:27:8502] D: [wsisrv|0|default|(null)]: lwsi_set_state: lwsi_set_state 0x20000016 -> 0x2000020a
Mar 03 00:25:27 hpb janus[49196]: [libwebsockets][INFO] [2025/03/03 00:25:27:8502] I: Upgrade to ws
Mar 03 00:25:27 hpb janus[49196]: [libwebsockets][INFO] [2025/03/03 00:25:27:8502] I: lws_process_ws_upgrade: defaulting to prot handler 0
Mar 03 00:25:27 hpb janus[49196]: [libwebsockets][DEBUG] [2025/03/03 00:25:27:8502] D: [wsisrv|0|default|(null)]: lws_ensure_user_space: protocol pss 0, user_space=(nil)
Mar 03 00:25:27 hpb janus[49196]: [libwebsockets][DEBUG] [2025/03/03 00:25:27:8502] D: [wsisrv|0|default|(null)]: lws_role_transition: wsistate 0x20000119, ops ws
Mar 03 00:25:27 hpb janus[49196]: [libwebsockets][DEBUG] [2025/03/03 00:25:27:8502] D: _realloc: size 368: ws struct
Mar 03 00:25:27 hpb janus[49196]: [libwebsockets][DEBUG] [2025/03/03 00:25:27:8502] D: [wsisrv|0|default|(null)]: lws_ensure_user_space: protocol pss 0, user_space=(nil)
Mar 03 00:25:27 hpb janus[49196]: [libwebsockets][WARN] [2025/03/03 00:25:27:8502] W: User code denied connection
Mar 03 00:25:27 hpb janus[49196]: [libwebsockets][INFO] [2025/03/03 00:25:27:8502] I: __lws_header_table_detach: [wsisrv|0|default|(null)]: ah 0x7a21f0006d20 (tsi=0, count = 1)
Mar 03 00:25:27 hpb janus[49196]: [libwebsockets][INFO] [2025/03/03 00:25:27:8502] I: __lws_header_table_detach: nobody usable waiting
Mar 03 00:25:27 hpb janus[49196]: [libwebsockets][INFO] [2025/03/03 00:25:27:8502] I: _lws_destroy_ah: freed ah 0x7a21f0006d20 : pool length 0
Mar 03 00:25:27 hpb janus[49196]: [libwebsockets][INFO] [2025/03/03 00:25:27:8502] I: __lws_header_table_detach: [wsisrv|0|default|(null)]: ah 0x7a21f0006d20 (tsi=0, count = 0)
Mar 03 00:25:27 hpb janus[49196]: [libwebsockets][INFO] [2025/03/03 00:25:27:8503] I: [wsisrv|0|default|(null)]: __lws_close_free_wsi: caller: lws_read_h1 bail
Mar 03 00:25:27 hpb janus[49196]: [libwebsockets][DEBUG] [2025/03/03 00:25:27:8503] D: [wsisrv|0|default|(null)]: __lws_close_free_wsi: real just_kill_connection A: (sockfd 24)
Mar 03 00:25:27 hpb janus[49196]: [libwebsockets][INFO] [2025/03/03 00:25:27:8503] I: __lws_close_free_wsi: shutdown conn: [wsisrv|0|default|(null)] (sk 24, state 0x119)
Mar 03 00:25:27 hpb janus[49196]: [libwebsockets][INFO] [2025/03/03 00:25:27:8503] I: [wsisrv|0|default|(null)]: __lws_close_free_wsi: real just_kill_connection: sockfd 24
Mar 03 00:25:27 hpb janus[49196]: [libwebsockets][DEBUG] [2025/03/03 00:25:27:8503] D: [wsi|1|listen|default||8188]: _lws_change_pollfd: fd 23 events 1 -> 1
Mar 03 00:25:27 hpb janus[49196]: [libwebsockets][DEBUG] [2025/03/03 00:25:27:8503] D: [wsisrv|0|default|(null)]: lwsi_set_state: lwsi_set_state 0x20000119 -> 0x20000020
Mar 03 00:25:27 hpb janus[49196]: [libwebsockets][INFO] [2025/03/03 00:25:27:8503] I: [wsisrv|0|default|(null)]: __lws_close_free_wsi: cce=1
Mar 03 00:25:27 hpb janus[49196]: [libwebsockets][DEBUG] [2025/03/03 00:25:27:8503] D: [wsisrv|0|default|(null)]: __lws_close_free_wsi_final: fd 24
Mar 03 00:25:27 hpb janus[49196]: [libwebsockets][DEBUG] [2025/03/03 00:25:27:8504] D: [wsi|1|listen|default||8188]: _lws_change_pollfd: fd 23 events 1 -> 1
Mar 03 00:25:27 hpb janus[49196]: [libwebsockets][DEBUG] [2025/03/03 00:25:27:8504] D: [wsisrv|0|default|(null)]: __lws_vhost_unbind_wsi: vh default: count_bound_wsi 1
Mar 03 00:25:27 hpb janus[49196]: [libwebsockets][DEBUG] [2025/03/03 00:25:27:8504] D: [wsisrv|0|default|(null)]: __lws_free_wsi: tsi fds count 3

**Comment by lminiero** [comment]
You're not setting the subprotocol.
https://janus.conf.meetecho.com/docs/rest#WS
