### ISSUE TITLE
SIP Plugin:  RE-INVITE with new RTP port and/or IP in SDP

### ISSUE THREAD

**Issue by shrhoads** [meetecho/janus-gateway#851]
I'm potentially observing an issue when a SIP reINVITE, and I couldn't tell if the code supported this.

https://tools.ietf.org/html/rfc3665#page-61

Given this call flow, assuming "Alice" is the Janus plugin and "Bob" is communicating with Janus, if Bob sends a reINVITE that specifies a new port and/or IP address in the SDP, using the reference in the link example:

F6: (the original OK SDP seen by Janus/Alice)

   v=0
   o=bob 2890844527 2890844527 IN IP4 client.biloxi.example.com
   s=-
   c=IN IP4 192.0.2.201
   t=0 0
   m=audio 3456 RTP/AVP 0
   a=rtpmap:0 PCMU/8000

And then F9 (the re-invite send from Bob to Janus/Alice)

   v=0
   o=bob 2890844527 2890844528 IN IP4 client.chicago.example.com
   s=-
   c=IN IP4 192.0.2.100
   t=0 0
   m=audio 47172 RTP/AVP 0
   a=rtpmap:0 PCMU/8000

You will notice the IP and port change in the reINVITE SDP (where Janus' outbound audio is headed).

The audio from Janus seems to be lost at this point (I assume it's still being broadcast to the original ip/port).  Do you know if this is supported and if it would be difficult to have the Janus SIP plugin to redirect the RTP to the new target?

**Comment by lminiero** [comment]
It should already work, as we reconnect the sockets to the new IP and/or port when we detect a session update: https://github.com/meetecho/janus-gateway/blob/master/plugins/janus_sip.c#L3196
Are you using an up-to-date version of the plugin? Try setting debug to 5 and checking if the logs can help you figure out if Janus is indeed detecting the changes making the right decisions here.

**Comment by shrhoads** [comment]
So this looks good:

Got a re-INVITE...
Someone is updating a call:
v=0
o=- 1491660482815505 1491660482815505 IN IP4 192.168.0.201
s=-
c=IN IP4 192.168.0.201
t=0 0
m=audio 17392 RTP/AVP 0 8 98 9 105
.....
[6666][nua_i_state]: 100 Trying
[6666][nua_i_state]: 200 OK
[6666][nua_i_ack]: 200 OK
[6666][nua_i_state]: 200 OK
[6666][nua_i_active]: 200 Call active
Got SIP peer audio SSRC: 2447654843
Audio SSRC changed, 1559923130 --> 2447654843

Also netstat looks OK:

udp        0      0 192.168.0.200:48184     192.168.0.201:17392     ESTABLISHED 30356/janus

Also the audio TO janus still works, I hear fine, it's just the audio from janus that seems to stop working.  (The transmitted audio from janus to the other endpoint.)  The 48184 port and ip look right, too.  Ok, other sip endpoints work, just not janus.  Not sure I will close it until I can figure out how to sniff the actual RTP to see if janus isn't sending it.

**Comment by lminiero** [comment]
You can use Wireshark or tcpdump for that.

**Comment by shrhoads** [comment]
Yeah working on it.  BTW, I did notice that after a few reinvites, janus keeps a lot of socket listeners open:

tcp        0      0 192.168.0.200:47018     *:*                     LISTEN      30356/janus
tcp        0      0 192.168.0.200:43979     *:*                     LISTEN      30356/janus
tcp        0      0 192.168.0.200:52238     *:*                     LISTEN      30356/janus
tcp        0      0 192.168.0.200:57107     *:*                     LISTEN      30356/janus
tcp        0      0 192.168.0.200:39349     *:*                     LISTEN      30356/janus
tcp        0      0 192.168.0.200:51286     *:*                     LISTEN      30356/janus

etc.  I wonder if the old port isn't being released on re-invite

**Comment by lminiero** [comment]
We don't change the local port for RTP in the Janus SIP plugin on re-INVITEs, we just connect the existing socket to the new port the peer advertizes. Besides, RTP goes over UDP and that looks like TCP.

**Comment by shrhoads** [comment]
Normal call with no re-INVITE

09:09:35.333786 IP 67.x.x.x.54064 > 173-x-x-x.net.10098: UDP, length 172 (outbound audio)
09:09:35.334675 IP 173-x-x-x.net.10098 > 67.x.x.x.54064: UDP, length 172 (inbound audio)

call with re-INVITE

09:18:16.691549 IP 173-x-x-x.net.10098 > 67.x.x.x.54892: UDP, length 172 (inbound audio)
09:18:16.712533 IP 173-x-x-x.net.10098 > 67.x.x.x.54892: UDP, length 172 (inbound audio)

I don't see any outbound audio.

If you want to try it with your local environment, use the demo sip plugin page, enter:

sip:sip.icoa.com
sip:77700006@sip.icoa.com
77700006
77700006  (pw)

Then dial number:

sip:2222@sip.icoa.com

You will hear audio, but you will no longer be sending audio.  I'm not 100% sure it's janus is there any reason janus wouldn't send the outbound audio?

**Comment by lminiero** [comment]
If it's still not behaving as expected for you then we should reopen it. I'll have a look myself either later or in the next few weeks with the info you provided.

**Comment by lminiero** [comment]
PS: have you checked if the re-INVITE changes the direction of the media? e.g., if it's `sendonly` the Janus plugin may be instructed not to send anything anymore.

**Comment by lminiero** [comment]
PPS: just tried with Asterisk's `directmedia=yes` feature, which results in a re-INVITE to both parties when you try to call somebody via Asterisk to have them connect to each other after an initial session establishment with Asterisk itself, and it seems to be working fine for me. I see media being exchanged with Asterisk at first, and then with the softphone I was calling.

**Comment by shrhoads** [comment]
Your on-hold branch made me go back and check the call sip sdp, and it's a mix of sendonly, recvonly and sendrecv.  The bug may not be related to the changing IP/Port but perhaps related to changing send/recv modes.

**Comment by lminiero** [comment]
Yep, I had the same doubt and that's why I asked the same thing above. If you could double check that would indeed help. I think we don't have any feedback available in `query_session` for that or otherwise we could see that via Admin API. If you can paste the full SDPs the two exchange via SIP that would help.

**Comment by shrhoads** [comment]
I have changed code on my side to always tell janus to "sendrecv" and the audio now works.

My app was telling janus to sendonly on the initial invite and then sendrecv on the re-invite.  I'll work on getting a full sdp trace for you from janus POV.

**Comment by lminiero** [comment]
Mh, then it might be a bug in the way we process the SDP in re-INVITEs... maybe if you start with `sendonly` then you might be stuck with it even after that? Have you checked if the on-hold PR behaves better than that?

**Comment by shrhoads** [comment]
On-hold PR did the same behavior.

**Comment by lminiero** [comment]
The code should behave properly:

https://github.com/meetecho/janus-gateway/blob/master/plugins/janus_sip.c#L2820

Everytime we get a new SDP, we check the media direction, and update `session->media.audio_send` accordingly. In your case, the new SDP containing `sendrecv` should result in `session->media.audio_send` being set to `TRUE`.

**Comment by shrhoads** [comment]
I changed it back and it does look like a problem with the SDP that was sent to janus and not necessarily janus.  I'm sorry, I will close and reopen if I can reproduce a problem.

**Comment by shrhoads** [comment]
203832881 = Customer hung up in the gap between voxeo was commanded to dial interpreter and dialing actually started (voxeo server was slow).  (123 again).
Fix is to check to see if customer disconnect happened in this gap and end interpreter call.
